content;score;sentiment_rating;wordCount;tweet_with_stopwords;wordCount_after_stopwords;tweet_stemmed
app ini bener bener bantu aku melegakan rasa sakit akibat kekerasan psikis dari sekitar termasuk keluarga dan tetangga.saya sudah diagnosis depresi. sehingga saya rentan bunuh diri. terimakasih app ini sangat membantu saya;5;Positive;34;app bener bener bantu melegakan sakit akibat kekerasan psikis keluarga tetanggasaya diagnosis depresi  rentan bunuh  terimakasih app membantu;18;app bener bener bantu melegakan sakit akibat kekerasan psiki keluarga tetanggasaya diagnosi depresi rentan bunuh terimakasih app membantu
bener bener aplikasi yang sangat berguna mau sungkem sama yang bikin;5;Positive;11;bener bener aplikasi berguna sungkem bikin;6;bener bener aplikasi berguna sungkem bikin
ok;5;Positive;1;ok;1;ok
sukaaa banget;5;Positive;2;sukaaa;1;sukaaa
mau sungkem sama yg buat apk ini , sangat membantu saya dalam belajar mengolah emosi dan menotivasi saya dalam hidup, saya merasa memountai temn bercerita , terimakasih riliv ;5;Positive;29;sungkem apk membantu belajar mengolah emosi menotivasi hidup memountai temn bercerita terimakasih riliv;13;sungkem apk membantu belajar mengolah emosi menotivasi hidup memountai temn bercerita terimakasih riliv
mudah di gunakan;5;Positive;3;mudah;1;mudah
baguss;5;Positive;1;baguss;1;baguss
bikin nyaman dan sangat membantu;5;Positive;5;bikin nyaman membantu;3;bikin nyaman membantu
aplikasi yang sangat membantu dalam menenangkan pikiran, i like it. bisa buat pelajaran, pengalaman, dan lain². aku sangat merekomendasikan aplikasi ini tetap semangat ya^^;5;Positive;29;aplikasi membantu menenangkan pikiran i like it  pelajaran pengalaman lain  merekomendasikan aplikasi semangat ya;14;aplikasi membantu menenangkan pikiran i like it pelajaran pengalaman lain merekomendasikan aplikasi semangat ya
keren;4;Positive;1;keren;1;keren
terimakasih riliv fitur fitur nya menarik semua ;5;Positive;7;terimakasih riliv fitur fitur menarik;5;terimakasih riliv fitur fitur menarik
alhamdulillah,cuma mendengarkan diriku bisa merasa tenang;5;Positive;8;alhamdulillah mendengarkan diriku tenang;4;alhamdulillah mendengarkan diriku tenang
aplikasi ini membantu saya untuk menjadi lebih baik;5;Positive;8;aplikasi membantu;2;aplikasi membantu
sangat menyenangkan dan sangat membantu proses pemulihan saya;5;Positive;8;menyenangkan membantu proses pemulihan;4;menyenangkan membantu prose pemulihan
sangat bermanfaat;5;Positive;2;bermanfaat;1;bermanfaat
bintang 3 dulu deh;3;Neutral;4;bintang  deh;2;bintang deh
terimakasih riliv berkat aplksi ini saya mnjdi lebih tenang dalam keadaan apapun.;5;Positive;13;terimakasih riliv berkat aplksi mnjdi tenang apapun ;7;terimakasih riliv berkat aplksi mnjdi tenang apapun
kasih mode gelap! dah gitu aja;4;Positive;7;kasih mode gelap  dah gitu;5;kasih mode gelap dah gitu
memuat data mulu, padahal udh di download;2;Negative;8;memuat data mulu udh;4;memuat data mulu udh
terimakasih;5;Positive;1;terimakasih;1;terimakasih
kasih bintang 4 dulu aja yya nanti kalau bagus ku kasih bintang 5;4;Positive;13;kasih bintang  yya bagus ku kasih bintang ;7;kasih bintang yya bagu ku kasih bintang
saya sangat suka dengan apk ini;5;Positive;6;suka apk;2;suka apk
sangat membantu:);5;Positive;4;membantu  ;1;membantu
sayang riliv banyak banyak ;5;Positive;4;sayang riliv;2;sayang riliv
good;5;Positive;1;good;1;good
aplikasi.a bgs ccekali;5;Positive;3;aplikasia bgs ccekali;3;aplikasia bg ccekali
bagus.;3;Neutral;2;bagus ;1;bagu
terimakasih ;5;Positive;1;terimakasih;1;terimakasih
gabisa daftar , gagal terus kenapaa ya;4;Positive;7;gabisa daftar gagal kenapaa;4;gabisa daftar gagal kenapaa
bagus bgt apk ini sumpahhhh aku ga bohong semuanya bisa kita lakuin;5;Positive;12;bagus apk sumpahhhh ga bohong lakuin;6;bagu apk sumpahhhh ga bohong lakuin
knpa saat saya mau daftar akun error y?;3;Neutral;9;knpa daftar akun error y ;5;knpa daftar akun error y
kenapa saya tidak bisa mendaftar? gagal terus;5;Positive;8;mendaftar  gagal;2;mendaftar gagal
kok pas daftar gk jadi yaa? ada yang tau kenapaa;2;Negative;11;pas daftar gk yaa  tau kenapaa;6;pa daftar gk yaa tau kenapaa
kenapa si ga bisa daftar masuk ke gmail gagal trus;4;Positive;10;si ga daftar masuk gmail gagal trus;7;si ga daftar masuk gmail gagal tru
kenapa saya waktu daftar gagal terus ya min;3;Neutral;8;daftar gagal min;3;daftar gagal min
maaf bintang satu baru download terus mau daftar tapi gagal terus disuruh nunggu beberapa menit tapi hasil tetap sama padahal lagi butuh banget;1;Negative;23;maaf bintang daftar gagal disuruh nunggu menit hasil butuh;9;maaf bintang daftar gagal disuruh nunggu menit hasil butuh
kenapa tidak bisa regis yaa?;3;Neutral;6;regis yaa ;2;regi yaa
kok gagal daftar terus ;4;Positive;4;gagal daftar;2;gagal daftar
mengapa saya tidak dapat login ya?;2;Negative;7;login ;1;login
kenapa ngga bisa daftar?;1;Negative;5;ngga daftar ;2;ngga daftar
kenapa ga bisa daftar?;1;Negative;5;ga daftar ;2;ga daftar
kenapa gagal mendaftarkan udh 10x loh kecewa;2;Negative;7;gagal mendaftarkan udh x loh kecewa;6;gagal mendaftarkan udh x loh kecewa
"""proses login gagal502""";1;Negative;5; proses login gagal ;3;prose login gagal
hai riliv..kok gak bisa login dan daftar ya?;2;Negative;11;hai riliv  gak login daftar ;5;hai riliv gak login daftar
baru mulai aja udh banyak bug nya;2;Negative;7;udh bug;2;udh bug
gag bisa login;3;Neutral;3;gag login;2;gag login
asu mo ngobatin mental malah depresi gara gra gak bisa login;2;Negative;11;asu mo ngobatin mental depresi gara gra gak login;9;asu mo ngobatin mental depresi gara gra gak login
"maaf sebelumnya, terima kasih karena telah menciptakan aplikasi sebagus ini:), tapi kenapa ya akhir"" ini saya tidak bisa menggunakan aplikasinya dan ad tulisan proses login gagal. terima kasih";5;Positive;34;maaf terima kasih menciptakan aplikasi sebagus    aplikasinya ad tulisan proses login gagal  terima kasih;14;maaf terima kasih menciptakan aplikasi sebagu aplikasinya ad tulisan prose login gagal terima kasih
mau daftar kok eror terus ya min,gabisa terus;2;Negative;10;daftar eror min gabisa;4;daftar eror min gabisa
ini kok proses gagal terus ya?;1;Negative;7;proses gagal ;2;prose gagal
aplikasinya keren... kalau kamu pengen meditasi gratis bisa paket kode referall yqavtu;5;Positive;13;aplikasinya keren  pengen meditasi gratis paket kode referall yqavtu;9;aplikasinya keren pengen meditasi grati paket kode referal yqavtu
berbayar gak sih??;1;Negative;5;berbayar gak  ;2;berbayar gak
loadingnya lama bgt udh gitu proses gagal mulu;2;Negative;8;loadingnya udh gitu proses gagal mulu;6;loadingnya udh gitu prose gagal mulu
"tolong dong perbaiki bru download awal nya bisa di pake tpi tiba"" mau masuk lgi login gagal,gk bisa liat apapun";1;Negative;23;tolong perbaiki bru pake tpi  masuk lgi login gagal gk liat apapun;12;tolong perbaiki bru pake tpi masuk lgi login gagal gk liat apapun
kenapa kalau memuat lama sekali;2;Negative;5;memuat;1;memuat
sangat membantu un;5;Positive;3;membantu un;2;membantu un
mau coba dulu;4;Positive;3;coba;1;coba
bagus;5;Positive;1;bagus;1;bagu
terimakasih riliv banyak membantu ku lebih baik, without you i do not know how be better feeling.;5;Positive;19;terimakasih riliv membantu ku without you i do not know how be better feeling ;14;terimakasih riliv membantu ku without you i do not know how be better feel
bagus bangeetttt, suka sama aplikasinya ;5;Positive;6;bagus bangeetttt suka aplikasinya;4;bagu bangeetttt suka aplikasinya
aplikasi yg sgt keren, ketika ak belum buka aplikasi ini, tangan dan kakiku basah krn cemas, setelah meditasi ak lgsg tenang dan tangan kakiku tdk basah lagi;5;Positive;30;aplikasi sgt keren ak buka aplikasi tangan kakiku basah krn cemas meditasi ak lgsg tenang tangan kakiku tdk basah;19;aplikasi sgt keren ak buka aplikasi tangan kakiku basah krn cema meditasi ak lgsg tenang tangan kakiku tdk basah
terimakasih sudah nyiptain aplikasi ini. jadi bisa nulis tentang keluh kesah, suka duka setiap hari dan tanpa dibaca orang lain. dan saya jadi bisa baca di lain waktu buat reminder.;5;Positive;34;terimakasih nyiptain aplikasi  nulis keluh kesah suka duka dibaca  baca reminder ;11;terimakasih nyiptain aplikasi nuli keluh kesah suka duka dibaca baca remind
aplikasinya menarik, ada sesi meditasi dan instrument yg cukup membantu merilekskan pikiran. ada sesi konseling juga bagi kalian yg memiliki beberapa hal/masalah yg barangkali perlu bantuan medis, dan ini cukup rekomend untuk kalian.;3;Neutral;37;aplikasinya menarik sesi meditasi instrument membantu merilekskan pikiran  sesi konseling memiliki halmasalah barangkali bantuan medis rekomend ;16;aplikasinya menarik sesi meditasi instrument membantu merilekskan pikiran sesi konsel memiliki halmasalah barangkali bantuan medi rekomend
bagus;5;Positive;1;bagus;1;bagu
sangat bagus;5;Positive;2;bagus;1;bagu
bagus, banyak fiturnya;5;Positive;4;bagus fiturnya;2;bagu fiturnya
terima kasih, riliv! saya bisa lebih segar nyaman dan tenang berkat aplikasi ini! aplikasinya sangat membantu untuk kesehatan mental. disini juga bisa meditasi dan konseling.;5;Positive;30;terima kasih riliv  segar nyaman tenang berkat aplikasi  aplikasinya membantu kesehatan mental  meditasi konseling ;14;terima kasih riliv segar nyaman tenang berkat aplikasi aplikasinya membantu kesehatan mental meditasi konsel
tambahkan meditasi untuk sakit hati, tolong kalo bisa jangan buat premium;4;Positive;12;tambahkan meditasi sakit hati tolong kalo premium;7;tambahkan meditasi sakit hati tolong kalo premium
teman buat yoga,buat tidur, enak deh medetasinya;5;Positive;10;teman yoga tidur enak deh medetasinya;6;teman yoga tidur enak deh medetasinya
apk ini mng bgs, bisa bikin stress hlang. nii kode refferal saya eicadx.;5;Positive;16;apk mng bgs bikin stress hlang  nii kode refferal eicadx ;10;apk mng bg bikin stress hlang nii kode reffer eicadx
sangat bagus;5;Positive;2;bagus;1;bagu
aplikasi yg bermanfaat untuk mindfullness;5;Positive;5;aplikasi bermanfaat mindfullness;3;aplikasi bermanfaat mindful
mudah² bisa memberikan q nasehat yg bisa membuat q lega...;5;Positive;11;mudah q nasehat q lega ;5;mudah q nasehat q lega
sangat membantu;5;Positive;2;membantu;1;membantu
bagus;5;Positive;1;bagus;1;bagu
hai guys tolong masukkan kode reveral zpbkod, biar kita bsa saling membantu satu sama lain;4;Positive;16;hai guys tolong masukkan kode reveral zpbkod biar bsa membantu;10;hai guy tolong masukkan kode rever zpbkod biar bsa membantu
cukup membantu tidur lelap;5;Positive;4;membantu tidur lelap;3;membantu tidur lelap
aplikasinya bagus;5;Positive;2;aplikasinya bagus;2;aplikasinya bagu
pake reverral ku ya 6nxih0 :);5;Positive;7;pake reverral ku nxih  ;4;pake reverr ku nxih
yuk saling membantu ini berguna banget loh mqwzo3;5;Positive;8;yuk membantu berguna loh mqwzo;5;yuk membantu berguna loh mqwzo
"bagus banget, cocok banget buat kamu yang mau nenangin diri, masukin kode ""rkvfjr"" ayo kita saling bantu";5;Positive;21;bagus cocok nenangin masukin kode  rkvfjr  ayo bantu;8;bagu cocok nenangin masukin kode rkvfjr ayo bantu
app yang sangat bagus;5;Positive;4;app bagus;2;app bagu
apakh ini berbayar?;5;Positive;4;apakh berbayar ;2;apakh berbayar
masukan kode referal ini wjjoge;5;Positive;5;masukan kode referal wjjoge;4;masukan kode refer wjjoge
terimakasih, karena dengan app riliv ini aku jadi sedikit tenang.;4;Positive;12;terimakasih app riliv tenang ;4;terimakasih app riliv tenang
terima kasih riliv, saya sangat terbantu dan jauh lebih tenang dari biasanya;5;Positive;13;terima kasih riliv terbantu tenang;5;terima kasih riliv terbantu tenang
lebih nyenyak tidur;5;Positive;3;nyenyak tidur;2;nyenyak tidur
aplikasinya bagus banget, membuat hidupku lebih tenang. saran dari sya kalau bisa buatan meditasi untuk menghilangkan pobia. terima kasih;5;Positive;22;aplikasinya bagus hidupku tenang  saran sya buatan meditasi menghilangkan pobia  terima kasih;12;aplikasinya bagu hidupku tenang saran sya buatan meditasi menghilangkan pobia terima kasih
cara log in nya gimana yaa? ko gabisa²;5;Positive;9;log in gimana yaa  ko gabisa;6;log in gimana yaa ko gabisa
sangat membantu;5;Positive;2;membantu;1;membantu
aplikasi yang sangat membantu;5;Positive;4;aplikasi membantu;2;aplikasi membantu
app nya bagus banget, alhamdulillah sejak pakai ini aku jadi lebih tenang. makasih riliv;5;Positive;16;app bagus alhamdulillah pakai tenang  makasih riliv;7;app bagu alhamdulillah pakai tenang makasih riliv
terimakasih riliv;5;Positive;2;terimakasih riliv;2;terimakasih riliv
"hai riliv. aplikasinya bagus banget, aku suka. tapi saran dikasih nada yang nenanging biar ga terlalu ""sepi"". btw, ini emang bener-bener bagus, bisa membantu banyak orang";5;Positive;34;hai riliv  aplikasinya bagus suka  saran dikasih nada nenanging biar ga  sepi   btw emang benerbener bagus membantu;17;hai riliv aplikasinya bagu suka saran dikasih nada nenang biar ga sepi btw emang benerben bagu membantu
sejauh ini sangat baik  saya harap bisa membeli fitur berbayarnya;5;Positive;10;harap membeli fitur berbayarnya;4;harap memb fitur berbayarnya
bener-bener membantu banget buat healing mental diri sendiri;5;Positive;8;benerbener membantu healing mental;4;benerben membantu heal mental
mau buka semua konten di riliv, ayoo gunakan referalku : 1bqo8z nikmati setiap konten yang menarik dan benefit banget apalagi buat kamu yang lagi butuh menenangkan dan mengheal diri sendiri sebagai pertolongan pertama kita ;5;Positive;35;buka konten riliv ayoo referalku  bqoz nikmati konten menarik benefit butuh menenangkan mengheal pertolongan;14;buka konten riliv ayoo referalku bqoz nikmati konten menarik benefit butuh menenangkan mengheal pertolongan
thanks riliv ;5;Positive;2;thanks riliv;2;thank riliv
sangat membantu, terimakasih;5;Positive;4;membantu terimakasih;2;membantu terimakasih
aplikasi berbayar smua ..males;1;Negative;5;aplikasi berbayar smua  males;4;aplikasi berbayar smua male
alhamdulillah;5;Positive;1;alhamdulillah;1;alhamdulillah
sangat bagus membantu saya dikala pikiran penuh dan banyak yg tdk bisa sy tuntaskan. makin inspiratif yah riliv ;5;Positive;19;bagus membantu dikala pikiran penuh tdk sy tuntaskan  inspiratif yah riliv;11;bagu membantu dikala pikiran penuh tdk sy tuntaskan inspiratif yah riliv
bagus;5;Positive;1;bagus;1;bagu
bagus;5;Positive;1;bagus;1;bagu
panduan meditasi yang baik!! terimakasih;5;Positive;7;panduan meditasi   terimakasih;3;panduan meditasi terimakasih
ini sangat membantu. terimakasih telah membuat aplikasi seperti ini;5;Positive;10;membantu  terimakasih aplikasi;3;membantu terimakasih aplikasi
suka sih sama aplikasinya, cuma kok ga bisa tersambung ke internet. padahal jaringan bagus loh ;4;Positive;17;suka aplikasinya ga tersambung internet  jaringan bagus loh;8;suka aplikasinya ga tersambung internet jaringan bagu loh
aplikasinya sangat bermanfaat membantu mereda umat manusia mengalami rasa stres, cemas, dll;5;Positive;14;aplikasinya bermanfaat membantu mereda umat manusia mengalami stres cemas dll;10;aplikasinya bermanfaat membantu mereda umat manusia mengalami stre cema dll
sukaaaaakk bangettt... pikiran ku menjadi tenang lagi... terimakasih riliv;5;Positive;11;sukaaaaakk bangettt  pikiran ku tenang  terimakasih riliv;7;sukaaaaakk bangettt pikiran ku tenang terimakasih riliv
baru download 2 hari, aplikasi yang bagus bangeet. cocok buat yang susah tidur :);5;Positive;17; aplikasi bagus bangeet  cocok susah tidur  ;6;aplikasi bagu bangeet cocok susah tidur
terima kasih, dengan ini saya merasa rileks;5;Positive;8;terima kasih rileks;3;terima kasih rilek
bagus;5;Positive;1;bagus;1;bagu
membantu sekali!! nyesel baru tau app yg membantu memperbaiki mental sabagus ini ;5;Positive;14;membantu   nyesel tau app membantu memperbaiki mental sabagus;8;membantu nyesel tau app membantu memperbaiki mental sabagu
hari ketiga download riliv. alhamdulillah langsung langganan paket meditasi setahun. lumayan jadi reminder dan journal saat gabisa cerita ke orang lain. thanks founder and all staff for creating this amazing app  god bless you all;5;Positive;38;ketiga riliv  alhamdulillah langsung langganan paket meditasi setahun  lumayan reminder journal gabisa cerita  thanks founder and all staff for creating this amazing app god bless you all;27;ketiga riliv alhamdulillah langsung langganan paket meditasi setahun lumayan remind journal gabisa cerita thank founder and all staff for creat thi amaz app god bless you all
semoga membantuu;5;Positive;2;semoga membantuu;2;semoga membantuu
masukan kode (japcso) aplikasi yg bagus untuk membangun mood jadi lebih baik;5;Positive;14;masukan kode  japcso  aplikasi bagus membangun mood;7;masukan kode japcso aplikasi bagu membangun mood
aplikasi ini sungguh sangat membantu. aplikasi ini jd temanku disaat aku ngga punya siapa2;5;Positive;15;aplikasi sungguh membantu  aplikasi jd temanku disaat ngga siapa;9;aplikasi sungguh membantu aplikasi jd temanku disaat ngga siapa
pertama udah suka banget, berasa lebih enteng dan tenang.. terimakasih riliv;5;Positive;13;udah suka berasa enteng tenang  terimakasih riliv;7;udah suka berasa enteng tenang terimakasih riliv
gak seru ah masak diharuskan nyantumin nomer handphone;1;Negative;8;gak seru ah masak diharuskan nyantumin nomer handphone;8;gak seru ah masak diharuskan nyantumin nomer handphon
sangat membantu;5;Positive;2;membantu;1;membantu
aplikasi ini membuat pikiran saya menjadi tenang. membuat saya bisa melepaskan emosi dan energi negatif yang ada. juga membuat saya menjadi semakin bijak serta mengenal diri dan perasaan yang saya rasakan.;5;Positive;34;aplikasi pikiran tenang  melepaskan emosi energi negatif  bijak mengenal perasaan rasakan ;11;aplikasi pikiran tenang melepaskan emosi energi negatif bijak mengen perasaan rasakan
bagus;5;Positive;1;bagus;1;bagu
odb ;5;Positive;1;odb;1;odb
sangat membantu;5;Positive;2;membantu;1;membantu
suka bgt , apalagi tentang meditasi nya , hihi <3;5;Positive;11;suka meditasi hihi  ;3;suka meditasi hihi
suka;5;Positive;1;suka;1;suka
aplikasi yang bagus dan terbaik saya sangat menyukainya, saya belum menemukan kekurangan dari aplikasi ini. terima kasih riliv;5;Positive;20;aplikasi bagus terbaik menyukainya menemukan kekurangan aplikasi  terima kasih riliv;10;aplikasi bagu terbaik menyukainya menemukan kekurangan aplikasi terima kasih riliv
suka;5;Positive;1;suka;1;suka
bagus banget, pertama kali coba langsung ngerasain manfaatnya terima kasih;5;Positive;11;bagus kali coba langsung ngerasain manfaatnya terima kasih;8;bagu kali coba langsung ngerasain manfaatnya terima kasih
bagus;5;Positive;1;bagus;1;bagu
sangat memuaskan, dan bisa membuat diri lebih tenang;5;Positive;9;memuaskan tenang;2;memuaskan tenang
semua secara umum ok. kecuali pas konsultasi. jam masuk terlambat dan sangat amat tidak profesional jawaban nya. kesan nya malah menyalahkan. mending cari apk lain klo mau konsultasi psikolog online. untung cuma ambil paket 1x. klo lebih berasa rugi pake bgt. cus uninstall.;2;Negative;50;ok kecuali pas konsultasi  jam masuk terlambat profesional  kesan menyalahkan  mending cari apk klo konsultasi psikolog online  untung ambil paket x  klo berasa rugi pake  cus uninstall ;27;ok kecuali pa konsultasi jam masuk terlambat profesion kesan menyalahkan mend cari apk klo konsultasi psikolog onlin untung ambil paket x klo berasa rugi pake cu uninstal
terimakasih alhamdulillah aplikasinya keren untuk psikologi;5;Positive;6;terimakasih alhamdulillah aplikasinya keren psikologi;5;terimakasih alhamdulillah aplikasinya keren psikolog
bagus;5;Positive;1;bagus;1;bagu
apps relax;5;Positive;2;apps relax;2;app relax
baru di coba,, smga memuaskan;4;Positive;7;coba smga memuaskan;3;coba smga memuaskan
terimakasih riliv dengan adanya aplikasi mengenai kesehatan jiwa dari riliv saya semakin baik,dari semua sesi meditasi sangat nyaman digunakan serta memberikan hasil bagi kesehatan mental saya yang terganggu oleh anxiety disolder..;5;Positive;34;terimakasih riliv aplikasi kesehatan jiwa riliv sesi meditasi nyaman hasil kesehatan mental terganggu anxiety disolder ;15;terimakasih riliv aplikasi kesehatan jiwa riliv sesi meditasi nyaman hasil kesehatan mental terganggu anxieti disold
meditasi nya boleh sambil rebahan gak? :);5;Positive;9;meditasi rebahan gak   ;3;meditasi rebahan gak
bagus;5;Positive;1;bagus;1;bagu
keren;5;Positive;1;keren;1;keren
sangat membantu  terima kasih telah membuat aplikasi ini untuk menjadi lebih baik kedepannya!;5;Positive;14;membantu terima kasih aplikasi kedepannya ;5;membantu terima kasih aplikasi kedepannya
aplikasi ini membuatku nyaman saat mengisi kesepian dan ingin berobat ke psikolog meskipun belum ada kebolehan dari ibu. y masih terkendala biaya;5;Positive;23;aplikasi membuatku nyaman mengisi kesepian berobat psikolog kebolehan  y terkendala biaya;11;aplikasi membuatku nyaman mengisi kesepian berobat psikolog kebolehan y terkendala biaya
makasih riliv;5;Positive;2;makasih riliv;2;makasih riliv
suka, rekomen :);5;Positive;5;suka rekomen  ;2;suka rekomen
applikasi ini sangat2 membantu;4;Positive;4;applikasi sangat membantu;3;applikasi sangat membantu
i love myself more;5;Positive;4;i love myself more;4;i love myself more
saya baru download mau tanya untk pembayaran dri luar negri, itu gmna ya ? apkah ada pembayaran via transfer khusus luar negri kah?;4;Positive;25;untk pembayaran dri negri gmna  apkah pembayaran via transfer khusus negri kah ;12;untk pembayaran dri negri gmna apkah pembayaran via transfer khusu negri kah
puasss sekali,membantu saya yg sekarang sedang depresi menjadi lebih tenang;5;Positive;12;puasss membantu depresi tenang;4;puasss membantu depresi tenang
nyaman dan mudah;5;Positive;3;nyaman mudah;2;nyaman mudah
relatif memenuhi kebutuhan perbaikan kejiwaan/pola pikir seseorang/ pasien.;5;Positive;9;relatif memenuhi kebutuhan perbaikan kejiwaanpola pikir seseorang pasien ;8;relatif memenuhi kebutuhan perbaikan kejiwaanpola pikir seseorang pasien
gue suka banget aplikasi ini sangat membantu untuk meditasi dan ada bsnyak sekali pilihan sesuai kondisi yang dibutuhkan, dan yang paling penting (sebagian teks hilang);5;Positive;28;gue suka aplikasi membantu meditasi bsnyak pilihan sesuai kondisi dibutuhkan  teks hilang ;12;gue suka aplikasi membantu meditasi bsnyak pilihan sesuai kondisi dibutuhkan tek hilang
"halo.. ini aplikasi baru saya coba, dan baru di download udah bagus bangeeet ><. saya menyesal baru tau aplikasi ini :"" semoga membantu saya menghilangkan ptsd ku. karena kalau ke psikiater saya tidak cukup biayanya pasti cukup mahal. sekali lagi terimakasih untuk para developer yang sudah membuat aplikasi ini. salam hangat (◍•ᴗ•◍)✧*。";5;Positive;65;halo  aplikasi coba udah bagus bangeeet    menyesal tau aplikasi   semoga membantu menghilangkan ptsd ku  psikiater biayanya mahal  terimakasih developer aplikasi  salam hangat      ;22;halo aplikasi coba udah bagu bangeeet menyes tau aplikasi semoga membantu menghilangkan ptsd ku psikiat biayanya mahal terimakasih develop aplikasi salam hangat
makasiii bangettt riliv, pokoknya suka bangettt sama app ;5;Positive;9;makasiii bangettt riliv pokoknya suka bangettt app;7;makasiii bangettt riliv pokoknya suka bangettt app
terimakasih kepada riliv... ini sangat membantu kehidupan saya, baik mental maupun fisik. walaupun konseling agak mahal tapi benar benar membantu... terima kasih riliv;5;Positive;27;terimakasih riliv  membantu kehidupan mental fisik  konseling mahal membantu  terima kasih riliv;12;terimakasih riliv membantu kehidupan mental fisik konsel mahal membantu terima kasih riliv
help me a lot;5;Positive;4;help me a lot;4;help me a lot
apk nya sangat membantu ;5;Positive;4;apk membantu;2;apk membantu
membantu sekali;5;Positive;2;membantu;1;membantu
baguss bangett apk nyaa huhu :(;5;Positive;7;baguss bangett apk nyaa huhu  ;5;baguss bangett apk nyaa huhu
mantap;5;Positive;1;mantap;1;mantap
aplikasi yang cukup membantu menenangkan pikiran dan perasaan sebelum beraktivitas. bagus.;5;Positive;13;aplikasi membantu menenangkan pikiran perasaan beraktivitas  bagus ;7;aplikasi membantu menenangkan pikiran perasaan beraktivita bagu
baru coba. tapi sudah lumayan memberi efek positif untuk aku yang gampang cemas. terima kasih riliv.;5;Positive;19;coba  lumayan efek positif gampang cemas  terima kasih riliv ;9;coba lumayan efek positif gampang cema terima kasih riliv
kok pas meditasi cuma seri 1 yang bisa, seri ke dua dan yang lainya gk kebuka?? apakah harus bayar??;3;Neutral;24;pas meditasi seri  seri lainya gk kebuka   bayar  ;8;pa meditasi seri seri lainya gk kebuka bayar
thank u riliv;5;Positive;3;thank u riliv;3;thank u riliv
sukaaaaa bangettt thank you;5;Positive;4;sukaaaaa bangettt thank you;4;sukaaaaa bangettt thank you
sangat membantu terima kasih;5;Positive;4;membantu terima kasih;3;membantu terima kasih
mantapppp sehari 100menit meditasi. karena setenang dan senyaman itu. aplikasi yg dibuat oleh para profesional. luar biasa;5;Positive;20;mantapppp sehari menit meditasi  setenang senyaman  aplikasi profesional ;8;mantapppp sehari menit meditasi setenang senyaman aplikasi profesion
membantu banget buat kalian yang stres tapi gak tau buat nenangin gimana,ini apk bagus banget;5;Positive;17;membantu stres gak tau nenangin gimana apk bagus;8;membantu stre gak tau nenangin gimana apk bagu
aku suka dengerin nya dan apl ini mudah digunakan, semangat!!;5;Positive;13;suka dengerin apl mudah semangat  ;5;suka dengerin apl mudah semangat
aplikasi baguuus banget. dan sangat membantuuu. bersyukur banget nemu aplikasi inii. ;5;Positive;14;aplikasi baguuus  membantuuu  bersyukur nemu aplikasi inii ;7;aplikasi baguuu membantuuu bersyukur nemu aplikasi inii
keren;5;Positive;1;keren;1;keren
good;5;Positive;1;good;1;good
