content;score;sentiment_rating;wordCount;tweet_with_stopwords;wordCount_after_stopwords;tweet_stemmed
terima kasih kak.. ;4;Positive;4;terima kasih kak ;3;terima kasih kak
kenapaa ya saya ga bisa daftar, signup error mulu;1;Negative;10;kenapaa ga daftar signup error mulu;6;kenapaa ga daftar signup error mulu
kampret;1;Negative;1;kampret;1;kampret
pembohong sudah bayar respon slow! mau nunggu orang mati dulu baru direspon!!!;1;Negative;16;pembohong bayar respon slow  nunggu mati direspon   ;7;pembohong bayar respon slow nunggu mati direspon
bagaimana saya udh pake free trial, tpi belom dijawab² juga. kayanya bakal dijawab 1×24 jam;5;Positive;17;udh pake free trial tpi belom dijawab  kayanya  jam;9;udh pake free trial tpi belom dijawab kayanya jam
kalo buat pengangguran seperti saya bagaimna bisa curhat.. blom curhat aj udah disuruh bayar, wong saya mao curhat masalah ekonomi kok udah disuruh bayar.. pie to..?? anda tidak membantu..!! anda sama saja mengambil kesempatan dalam kesempitan orang lain..;1;Negative;48;kalo pengangguran bagaimna curhat  blom curhat aj udah disuruh bayar mao curhat ekonomi udah disuruh bayar  pie to    membantu    mengambil kesempatan kesempitan ;22;kalo pengangguran bagaimna curhat blom curhat aj udah disuruh bayar mao curhat ekonomi udah disuruh bayar pie to membantu mengambil kesempatan kesempitan
mbak audrey tolong dong 80.000 menurut saya masih mahal, 50.000 aja harusnya :( tolong jangan memikirkan untuk orang yang sudah kerja saja tetapi anak sekolah juga :( sekarang ini juga banyak banget loh mbak kasus anak2 yang jadi korban broken home, pasti mereka butuh psikolog tapi duit darimana kalau se mahal itu 1 sesinya aja :(;3;Neutral;61;mbak audrey tolong  mahal    tolong memikirkan kerja anak sekolah   loh mbak anak korban broken home butuh psikolog duit darimana mahal  sesinya  ;21;mbak audrey tolong mahal tolong memikirkan kerja anak sekolah loh mbak anak korban broken home butuh psikolog duit darimana mahal sesinya
"pakek bayr"" dulu sih.. d gambar padahal gx da suruh bayar"" rugi kuota dah..";2;Negative;18;pakek bayr   d gambar gx da suruh bayar  rugi kuota dah ;11;pakek bayr d gambar gx da suruh bayar rugi kuota dah
saya tidak mau install line, saya berharap riliv juga memfasilitasi pengguna whatsapp. terima kasih;2;Negative;16;install line berharap riliv memfasilitasi pengguna whatsapp  terima kasih;9;instal line berharap riliv memfasilitasi pengguna whatsapp terima kasih
kecewa.. lebih suka versi yg dulu.. jika seperti ini aku yakin sebagian besar org tdk akan menyukai versi yg sekarang. tolong kembalikan versi yg dulu..;1;Negative;29;kecewa  suka versi  org tdk menyukai versi  tolong kembalikan versi ;10;kecewa suka versi org tdk menyukai versi tolong kembalikan versi
kembalikan fitur curhat dengan komunitas.;5;Positive;6;kembalikan fitur curhat komunitas ;4;kembalikan fitur curhat komunita
"benar2 payah. bayar nya mahal curhat 4 hari lalu blm di bls sampai 
sekarang. hubungi cs cuma suruh nunggu";1;Negative;21;benar payah  bayar mahal curhat  blm bls  hubungi cs suruh nunggu;11;benar payah bayar mahal curhat blm bl hubungi cs suruh nunggu
"saya pikir ini solusi untuk masalah saya, ternyata ini adalah app berbayar, 
sementara untuk 1x free trial harus mendownload line terlebih dahulu, 
mungkin lebih baik pengguna yang low budget diberi kesempatan yang lebih 
baik.";3;Neutral;38;pikir solusi app berbayar x free trial mendownload line pengguna low budget kesempatan ;13;pikir solusi app berbayar x free trial mendownload line pengguna low budget kesempatan
baru mau pake nie semoga bisa membantu kembangkan terus ya riliv;5;Positive;11;pake nie semoga membantu kembangkan riliv;6;pake nie semoga membantu kembangkan riliv
kok buat login ja susah bgt ya?? ada yg tw solusinya?;1;Negative;14;login ja susah   tw solusinya ;5;login ja susah tw solusinya
udah chat lewat line gak ada balasan?;1;Negative;8;udah chat line gak balasan ;5;udah chat line gak balasan
saya sudah menghubungi line nya tapi tidak ada tanggapan di chting riliv;4;Positive;12;menghubungi line tanggapan chting riliv;5;menghubungi line tanggapan chting riliv
udah gak kayak dulu  butuh banget padahal;1;Negative;7;udah gak kayak butuh;4;udah gak kayak butuh
ga bisa log in ini mah diulang ulang malah ga bisa di buka lagi;1;Negative;14;ga log in mah diulang ulang ga buka;8;ga log in mah diulang ulang ga buka
aku udah bayar tapi kok gabisa sign;1;Negative;7;udah bayar gabisa sign;4;udah bayar gabisa sign
"saya dulu sukaaaaaa banget make aplikasi ini, bisa saling sharring dengan 
sesama pengguna, agak sedih sih skarng harus bayar, tapi tetap dukung 
aplikasi ini:)";5;Positive;29;sukaaaaaa make aplikasi sharring pengguna sedih skarng bayar dukung aplikasi  ;10;sukaaaaaa make aplikasi shar pengguna sedih skarng bayar dukung aplikasi
"riliv payah sekarang gak kyk riliv versi lama, masa mai dpt 1 free 
consultant ke psikolog harus download line dulu, makan waktu,saya copot 
lagi, saya download aplikasi curhad aja,lebih bagus dr ini";1;Negative;39;riliv payah gak kyk riliv versi mai dpt  free consultant psikolog line makan copot aplikasi curhad bagus dr;18;riliv payah gak kyk riliv versi mai dpt free consult psikolog line makan copot aplikasi curhad bagu dr
"saya dukung aplikasi ini, emg benar mereka juga butuh makan dan juga ngaji 
karyawan. jadi wajar klo harus berbayar";5;Positive;21;dukung aplikasi emg butuh makan ngaji karyawan  wajar klo berbayar;10;dukung aplikasi emg butuh makan ngaji karyawan wajar klo berbayar
"uninstal lagi, gak kayak dlu bisa konseling sesama pengguna, sekarang mesti 
bayar";1;Negative;14;uninstal gak kayak dlu konseling pengguna mesti bayar;8;uninst gak kayak dlu konsel pengguna mesti bayar
"saya merasa kecewa karena tidk ada sesi konsultasi sesama prngguna... 
memang sih ada user yg menyebalkan tapi ada beberapa user yang memiliki 
kemapuan di bidang psikologi dan bisa menjadi tman curhat yang baik...";2;Negative;35;kecewa tidk sesi konsultasi prngguna  user menyebalkan user memiliki kemapuan bidang psikologi tman curhat ;14;kecewa tidk sesi konsultasi prngguna user menyebalkan user memiliki kemapuan bidang psikolog tman curhat
tidak bisa masuk dengan facebook, tapi dengan google bisa;3;Neutral;10;masuk facebook google;3;masuk facebook googl
rindu sama sesi konsultasi di community;5;Positive;6;rindu sesi konsultasi community;4;rindu sesi konsultasi commun
g ada respon*-*;2;Negative;6;g respon   ;2;g respon
"waktu belum diperbarui app ini bgs banget dan sekarang tetep bgs karna bisa 
dgn psikolog ny langsung tapi sekarang harus dibayar, menurut ku bgs an yg 
sebelum di perbarui karna bisa curhat dgn sesama pengguna";4;Positive;36;diperbarui app bgs tetep bgs karna dgn psikolog ny langsung dibayar ku bgs an perbarui karna curhat dgn pengguna;19;diperbarui app bg tetep bg karna dgn psikolog ny langsung dibayar ku bg an perbarui karna curhat dgn pengguna
oooh.. versi terbaru ga bisa chat ke sesama pengguna ya?;3;Neutral;12;oooh  versi terbaru ga chat pengguna ;6;oooh versi terbaru ga chat pengguna
"suka banget sama app ini. bisa ngeluarin uneg2 dan bisa dapat solusi yg 
positif";5;Positive;15;suka app  ngeluarin uneg solusi positif;6;suka app ngeluarin uneg solusi positif
good;5;Positive;1;good;1;good
"suka sama aplikasi ini. membantu setiap ada masalah, ataupun sebatas keluh 
kesah di sini";5;Positive;16;suka aplikasi  membantu sebatas keluh kesah;6;suka aplikasi membantu sebata keluh kesah
aplikasi sangat membantu sekali dalam mengurangi depresi bagi penggunanya;5;Positive;9;aplikasi membantu mengurangi depresi penggunanya;5;aplikasi membantu mengurangi depresi penggunanya
menyimpan perasaan yang belum tersampaikan;5;Positive;5;menyimpan perasaan;2;menyimpan perasaan
"di sini... semua bisa ku ungkapin... dan dari sini aku bisa merasa lega dan 
bisa membantu teman2 yang membutuhkan masukan...";5;Positive;23; ku ungkapin  lega membantu teman membutuhkan masukan ;7;ku ungkapin lega membantu teman membutuhkan masukan
"saya suka dengan aplikasi ini. disini kita bisa membantu orang lain 
memecahkan masalah yang mungkin pernah/sedang kita alami juga saat ini. 
disini kita juga bisa mendapatkan saran yang baik dari para pengguna lain. 
suka deh";4;Positive;38;suka aplikasi  membantu memecahkan pernahsedang alami  saran pengguna  suka deh;10;suka aplikasi membantu memecahkan pernahsedang alami saran pengguna suka deh
sangat membantu sekali;4;Positive;3;membantu;1;membantu
bagus lebih ditingktkn lgi,;5;Positive;5;bagus ditingktkn lgi;3;bagu ditingktkn lgi
lucu;5;Positive;1;lucu;1;lucu
keren;5;Positive;1;keren;1;keren
baru di download , error, keluar keluar terus aplikasinya;1;Negative;10;error aplikasinya;2;error aplikasinya
sangat membantu;5;Positive;2;membantu;1;membantu
"suka aja. bs bertukar pendapat tanpa tau siapa kita. dan tanpa tau siapa yg 
ksh nasehat.  punya bnyak temen dehh";5;Positive;23;suka  bs bertukar pendapat tau  tau ksh nasehat  bnyak temen dehh;11;suka bs bertukar pendapat tau tau ksh nasehat bnyak temen dehh
mantap inih aplikasi.;5;Positive;4;mantap inih aplikasi ;3;mantap inih aplikasi
app nya sangat teramat bagus walaupun banyak komentar negatif tetapi app ini mendukung saya dan perhatian kepada saya saya suka;5;Positive;20;app teramat bagus komentar negatif app mendukung perhatian suka;9;app teramat bagu komentar negatif app mendukung perhatian suka
ko gk bisa di akses;1;Negative;5;ko gk akses;3;ko gk aks
gi mana cara bikin akun riliv?;2;Negative;7;gi bikin akun riliv ;4;gi bikin akun riliv
sangat membantu, apalagi buat orang2 yg bingung mau curhat atau berbagi cerita, identitas juga terjaga, dan bisa menambah tingkatan sosialisasi dan bisa saling membantu... thanksss..;5;Positive;30;membantu orang bingung curhat berbagi cerita identitas terjaga menambah tingkatan sosialisasi membantu  thanksss ;13;membantu orang bingung curhat berbagi cerita identita terjaga menambah tingkatan sosialisasi membantu thanksss
"aku pikir lgsg expertx yg balas kayak alo dokter. tp ternyata berbayar ya.. 
blm tau bagus atau tidak krna blm ada respon dr ""real person"" haha... jd 
jatohnya kayak curhat di sosmed ya... bedanya identitas bisa disamarkan... 
sedikit kecewa sih pas baca kata ""berbayar"" hehe... tp teringat ada harga 
ada kualitas kan yaa :d";3;Neutral;65;pikir lgsg expertx balas kayak alo dokter  tp berbayar  blm tau bagus krna blm respon dr  real person  haha  jd jatohnya kayak curhat sosmed  bedanya identitas disamarkan  kecewa pas baca  berbayar  hehe  tp harga kualitas yaa  d;37;pikir lgsg expertx bala kayak alo dokter tp berbayar blm tau bagu krna blm respon dr real person haha jd jatohnya kayak curhat sosm bedanya identita disamarkan kecewa pa baca berbayar hehe tp harga kualita yaa d
ga nyesel deh aku download aplikasi ini:);5;Positive;9;ga nyesel deh aplikasi  ;4;ga nyesel deh aplikasi
"suka banget. bisa sharing apapun masalhnya dan bisa tau masalah orang"" jd bisa untuk pembelajaran juga. mendadak saya jadi bijak klo memberi saran ke orang ";5;Positive;28;suka  sharing apapun masalhnya tau  jd pembelajaran  mendadak bijak klo saran;11;suka share apapun masalhnya tau jd pembelajaran mendadak bijak klo saran
sangat membantu.;5;Positive;3;membantu ;1;membantu
sangat membantu;5;Positive;2;membantu;1;membantu
aplikasi nya bagus bgtt, saya bisa curhat dan tanggapan nya baik;5;Positive;12;aplikasi bagus bgtt curhat tanggapan;5;aplikasi bagu bgtt curhat tanggapan
g ada kah pesikoloh beneran;4;Positive;5;g kah pesikoloh beneran;4;g kah pesikoloh beneran
semoga bnyak masalah terselesaikan;5;Positive;4;semoga bnyak terselesaikan;3;semoga bnyak terselesaikan
bisa menyapaikan;4;Positive;2;menyapaikan;1;menyapaikan
good app...  aplikasi yg saling memberi solusi dan saran antar anggota trhadap setiap permasalahan..  namun... sayangnya, ketika membuat suatu statment yg tujuannya buat ngajak diskusi bersama, atau pertanyaan yg sifatnya penting/berbobot utk dibahas malah nggak ada user yg jawab..  ketika memberi respon terhadap pertanyaan user yg bertanya sangat jarang yg mau respon dg bertukar pikiran atau saling akrab..;3;Neutral;65;good app  aplikasi solusi saran anggota trhadap permasalahan   sayangnya statment tujuannya ngajak diskusi sifatnya pentingberbobot utk dibahas nggak user  respon user jarang respon dg bertukar pikiran akrab ;27;good app aplikasi solusi saran anggota trhadap permasalahan sayangnya statment tujuannya ngajak diskusi sifatnya pentingberbobot utk dibaha nggak user respon user jarang respon dg bertukar pikiran akrab
semoga msalah cpt berlalu stlh curhat di sini;4;Positive;8;semoga msalah cpt stlh curhat;5;semoga msalah cpt stlh curhat
good;5;Positive;1;good;1;good
saya sangat berterima kasih dengan hadirnya app ini;5;Positive;8;berterima kasih hadirnya app;4;berterima kasih hadirnya app
app yang sangat membantu!;5;Positive;5;app membantu ;2;app membantu
kurang menarik;5;Positive;2;menarik;1;menarik
respon yang sangat baik dan cepat.;4;Positive;7;respon cepat ;2;respon cepat
bagus;5;Positive;1;bagus;1;bagu
mantap bngt aplikasi ini;5;Positive;4;mantap bngt aplikasi;3;mantap bngt aplikasi
bagus saya agak terbantu oleh jawaban dari komunitas;5;Positive;8;bagus terbantu komunitas;3;bagu terbantu komunita
aku sangat suka, karena aplikasi ini membuat saya bisa mengenali kakak kakak yang memberikan saya motivasi. saya sangat senang memiliki kakak, karena saya tidak mempunyai kakak :(;5;Positive;31;suka aplikasi mengenali kakak kakak motivasi  senang memiliki kakak kakak  ;10;suka aplikasi mengenali kakak kakak motivasi senang memiliki kakak kakak
aplikasi dalam proses pengembangan dan tkdak bisa masuk. lantas untuk apa membuat aplikasi ini kalau belum bisa?;1;Negative;19;aplikasi proses pengembangan tkdak masuk  lantas aplikasi ;7;aplikasi prose pengembangan tkdak masuk lanta aplikasi
mau coba sapa bisa;4;Positive;4;coba sapa;2;coba sapa
good;4;Positive;1;good;1;good
gak bisa recovery password, gak masuk ke email terus.;3;Neutral;11;gak recovery password gak masuk email ;6;gak recoveri password gak masuk email
suka sama apk ini. selain bisa curhat. disini juga kita bisa saling bantu.;4;Positive;16;suka apk  curhat  bantu ;4;suka apk curhat bantu
notification?;5;Positive;2;notification ;1;notif
syukurlah, saya bisa berbagi pengalaman kepada kalian tanpa ada yang mengetahui bahwa itu saya. dalam aplikasi ini saya senang sekali membantu klienku. dengan semangat aku selalu menjawab² pertanyaan dan keluh kesah mereka dengan harapan supaya mereka dapat bangkit dalam keterpurukannya itu:).;5;Positive;47;syukurlah berbagi pengalaman  aplikasi senang membantu klienku  semangat menjawab keluh kesah harapan bangkit keterpurukannya   ;14;syukurlah berbagi pengalaman aplikasi senang membantu klienku semangat menjawab keluh kesah harapan bangkit keterpurukannya
kenapa saat dibuka ada tulisan server maintenance, bagaimana caranya? yang berpengalaman tolong ajari saya terimakasih;2;Negative;17;dibuka tulisan server maintenance  berpengalaman tolong ajari terimakasih;8;dibuka tulisan server mainten berpengalaman tolong ajari terimakasih
sukaaaaaa;5;Positive;1;sukaaaaaa;1;sukaaaaaa
kenapa ga bisa log in?;1;Negative;6;ga log in ;3;ga log in
payah gak bisa dibuka..;1;Negative;5;payah gak dibuka ;3;payah gak dibuka
bagus bangettt;5;Positive;2;bagus bangettt;2;bagu bangettt
terima kasih;5;Positive;2;terima kasih;2;terima kasih
semoga bisa benar benar membantu;5;Positive;5;semoga membantu;2;semoga membantu
lumayan aku ada tempat curhat;3;Neutral;5;lumayan curhat;2;lumayan curhat
love it;4;Positive;2;love it;2;love it
ini cara daftarnya gimna?? tolong respon;3;Neutral;8;daftarnya gimna   tolong respon;4;daftarnya gimna tolong respon
lumayan dapet temen baru;4;Positive;4;lumayan dapet temen;3;lumayan dapet temen
sebenernya suka sih, setelah aku curhatin masalahku fast respon, tapi pas jawab chat sama teman riliv sering lama terkirimnya :(..;4;Positive;24;sebenernya suka curhatin masalahku fast respon pas chat teman riliv terkirimnya   ;11;sebenernya suka curhatin masalahku fast respon pa chat teman riliv terkirimnya
maintance mulu,;1;Negative;3;maintance mulu;2;maintanc mulu
ini gabisa dibukaaa :(;2;Negative;5;gabisa dibukaaa  ;2;gabisa dibukaaa
kok enggak bisa dibuka aplikasinya;1;Negative;5;dibuka aplikasinya;2;dibuka aplikasinya
good;3;Neutral;1;good;1;good
saya suka;5;Positive;2;suka;1;suka
ngebung mulu nih , ngk bisa buka chat nih;3;Neutral;9;ngebung mulu nih ngk buka chat nih;7;ngebung mulu nih ngk buka chat nih
aplikasi keren, enak banget buat curhat tanpa takut digosipin, takut kebongkar, dan bisa dapat teman baru yang ga jarang pengalamannya hampir sama. terimakasih banyak!! ;5;Positive;30;aplikasi keren enak curhat takut digosipin takut kebongkar teman ga jarang pengalamannya  terimakasih  ;13;aplikasi keren enak curhat takut digosipin takut kebongkar teman ga jarang pengalamannya terimakasih
app nya bgus bngt;5;Positive;4;app bgus bngt;3;app bgu bngt
maintenance kok sampe 3 hari..zzzz;1;Negative;7;maintenance sampe   zzzz;3;mainten samp zzzz
kok tidak bisa dibuka setelah download ??;2;Negative;8;dibuka  ;1;dibuka
kok aplikasi nya gak bisa dibuka;3;Neutral;6;aplikasi gak dibuka;3;aplikasi gak dibuka
maintenance in progress... bad day;3;Neutral;6;maintenance in progress  bad day;5;mainten in progress bad day
gak bisa di buka appnya... server maintenance...;1;Negative;9;gak buka appnya  server maintenance ;5;gak buka appnya server mainten
ini knp ya kok ada tulisan server maintenance?;2;Negative;9;knp tulisan server maintenance ;4;knp tulisan server mainten
server maintenance terus..;2;Negative;4;server maintenance ;2;server mainten
good;5;Positive;1;good;1;good
seneng gue bisa ngasih saran, sayang baru sedikitn penggunanya;4;Positive;10;seneng gue ngasih saran sayang sedikitn penggunanya;7;seneng gue ngasih saran sayang sedikitn penggunanya
selain bermanfaat sekaligus menolong saya juga jdi punya bnyak teman;5;Positive;10;bermanfaat menolong jdi bnyak teman;5;bermanfaat menolong jdi bnyak teman
keren, yg lain harus pakai app ini;5;Positive;8;keren pakai app;3;keren pakai app
kyaaa makasihh sukaa;5;Positive;3;kyaaa makasihh sukaa;3;kyaaa makasihh sukaa
bagus nih buat yg gapunya temen wkwk;5;Positive;7;bagus nih gapunya temen wkwk;5;bagu nih gapunya temen wkwk
bagus ni;5;Positive;2;bagus ni;2;bagu ni
sukak banget karna ini sangat membantu akuuu;5;Positive;7;sukak karna membantu akuuu;4;sukak karna membantu akuuu
jmpol;5;Positive;1;jmpol;1;jmpol
good;5;Positive;1;good;1;good
good;4;Positive;1;good;1;good
apk bagus.. drpd curhat di medsos jadi gosip tetangga. mending disini privasi terjaga dan ada respon teman;5;Positive;19;apk bagus  drpd curhat medsos gosip tetangga  mending privasi terjaga respon teman;12;apk bagu drpd curhat medso gosip tetangga mend privasi terjaga respon teman
meringankan beban di pikiran ;5;Positive;4;meringankan beban pikiran;3;meringankan beban pikiran
sangat bagus . aku langsung dapat tanggapan yang positif. pokoknya 2 jempol buat apps ini.;5;Positive;17;bagus  langsung tanggapan positif  pokoknya  jempol apps ;7;bagu langsung tanggapan positif pokoknya jempol app
app ini baguss bgt dijamin ganyesel deh downloadnya, karna respon disini sangat membantu,buat kalian yang bnyk masalah aku saranin kalian gunain app riliv ini, karna ini bisa nyelesain masalah kalian hehhe;5;Positive;35;app baguss dijamin ganyesel deh downloadnya karna respon membantu bnyk saranin gunain app riliv karna nyelesain hehhe;17;app baguss dijamin ganyesel deh downloadnya karna respon membantu bnyk saranin gunain app riliv karna nyelesain hehh
mantap;5;Positive;1;mantap;1;mantap
thx, your good;5;Positive;4;thx your good;3;thx your good
aplikasi terbaik untuk saling membantu secara batin;5;Positive;7;aplikasi terbaik membantu batin;4;aplikasi terbaik membantu batin
bisa meringankan beban, terimakasih;5;Positive;5;meringankan beban terimakasih;3;meringankan beban terimakasih
cara ngirim bintang gimana sii;5;Positive;5;ngirim bintang gimana sii;4;ngirim bintang gimana sii
kok gak bisa di buka;2;Negative;5;gak buka;2;gak buka
good;4;Positive;1;good;1;good
gk bisa dibuka:( terhenti terus..;2;Negative;8;gk dibuka   terhenti ;3;gk dibuka terhenti
aku kasih bntang 3 ajah dlu mau nyoba,  siapa tau bisa bantu;3;Neutral;13;kasih bntang  ajah dlu nyoba tau bantu;7;kasih bntang ajah dlu nyoba tau bantu
i love;5;Positive;2;i love;2;i love
suka banget;5;Positive;2;suka;1;suka
nice. saya suka aplikasi ini.;4;Positive;7;nice  suka aplikasi ;3;nice suka aplikasi
suka banget.;5;Positive;3;suka ;1;suka
pas lupa password minta kode verivikasi di gmail saya malah ga respon2 ;1;Negative;12;pas lupa password kode verivikasi gmail ga respon;8;pa lupa password kode verivikasi gmail ga respon
aku berharap banyak pada aplikasi ini :);5;Positive;8;berharap aplikasi  ;2;berharap aplikasi
baguss juga, kalo bisa tambah fitur lain lagi biar tambah bagus;5;Positive;12;baguss kalo fitur biar bagus;5;baguss kalo fitur biar bagu
butuh respon cepat:(;5;Positive;5;butuh respon cepat  ;3;butuh respon cepat
makasih;5;Positive;1;makasih;1;makasih
sangat bagus tapi harap lebih ditingkatkan lagi masih banyak kekurangannya;5;Positive;10;bagus harap ditingkatkan kekurangannya;4;bagu harap ditingkatkan kekurangannya
sangat membantu;5;Positive;2;membantu;1;membantu
zombi time is over;5;Positive;4;zombi time is over;4;zombi time is over
aku suka;5;Positive;2;suka;1;suka
setelah beberapa kali bongkar pasang aplikasi ini karena ga bisa log in akhirnya aku bisa log in yeaay. tapi masih sedikit user yang curhat atau memang koneksi aku yang lemot  huhu;3;Neutral;32;kali bongkar pasang aplikasi ga log in log in yeaay  user curhat koneksi lemot huhu;15;kali bongkar pasang aplikasi ga log in log in yeaay user curhat koneksi lemot huhu
keren;5;Positive;1;keren;1;keren
ok lah;5;Positive;2;ok;1;ok
waw suka sekali;5;Positive;3;waw suka;2;waw suka
god;5;Positive;1;god;1;god
suka;5;Positive;1;suka;1;suka
nunggu yang support;4;Positive;3;nunggu support;2;nunggu support
aplikasi ini bagus untuk yang ingin curhat, mohon tingkatkan terus menjadi lebih baik lagi. terima kasih;5;Positive;18;aplikasi bagus curhat mohon tingkatkan  terima kasih;7;aplikasi bagu curhat mohon tingkatkan terima kasih
bagus gw agak tenang curhat disini;5;Positive;6;bagus gw tenang curhat;4;bagu gw tenang curhat
mantap;5;Positive;1;mantap;1;mantap
kok loading ny lama. mau sign in susah bgt;2;Negative;10;loading ny  sign in susah;5;load ny sign in susah
pertama kali coba, langsung dapat fast response dr salah satu user community, dan pembahasannya baik, terimakasih, semoga makin baik app nya;4;Positive;25;kali coba langsung fast response dr salah user community pembahasannya terimakasih semoga app;13;kali coba langsung fast respons dr salah user commun pembahasannya terimakasih semoga app
kalo ada peringatan  scedhuled maintanance digimanain ya..ini ga bs login;4;Positive;12;kalo peringatan scedhuled maintanance digimanain  ga bs login;8;kalo peringatan scedhul maintan digimanain ga bs login
terimah kasih banyak.;5;Positive;4;terimah kasih ;2;terimah kasih
sangat bermanfat. ini aplikasi yg slalu aku cari;5;Positive;9;bermanfat  aplikasi slalu cari;4;bermanfat aplikasi slalu cari
gue suka sama aplikasi ini, bisa ngungkapin keluh kesah pada tempanya.. dapet solusi juga, dapet temen baru juga.. bermanfaat deh buat lu semua yg suka curhat curhat di bikin instastory lah, update fb lah dll..  lebih baik curhat disini;5;Positive;45;gue suka aplikasi ngungkapin keluh kesah tempanya  dapet solusi dapet temen  bermanfaat deh lu suka curhat curhat bikin instastory update fb dll  curhat;23;gue suka aplikasi ngungkapin keluh kesah tempanya dapet solusi dapet temen bermanfaat deh lu suka curhat curhat bikin instastori updat fb dll curhat
sepi uy, ramein dong kasih banyak pembahasan;4;Positive;8;sepi uy ramein kasih pembahasan;5;sepi uy ramein kasih pembahasan
kok gak bisa di buka :(;1;Negative;7;gak buka  ;2;gak buka
sangat sukakkk deh, membantu bgt ketika lagi bingung sama masalah;5;Positive;11;sukakkk deh membantu bingung;4;sukakkk deh membantu bingung
good say;5;Positive;2;good say;2;good say
aku suka .. app ini bikin jatuh cinta deh pokoknya;5;Positive;10;suka  app bikin jatuh cinta deh pokoknya;7;suka app bikin jatuh cinta deh pokoknya
good lah app nya , :3;5;Positive;6;good app ;2;good app
sukak;5;Positive;1;sukak;1;sukak
bagus;5;Positive;1;bagus;1;bagu
"gabisa ngasih support krna batas limit minggu ini;(, gmn bisa ningkatin level klo ngasih support aja nggabisaa:'(.";3;Neutral;24;gabisa ngasih support krna batas limit minggu   gmn ningkatin level klo ngasih support nggabisaa   ;14;gabisa ngasih support krna bata limit minggu gmn ningkatin level klo ngasih support nggabisaa
please tolong saya gimana menggunakan aplikasi nya saya gak ngerti cara ngirim pesan nya;2;Negative;14;please tolong gimana aplikasi gak ngerti ngirim pesan;8;pleas tolong gimana aplikasi gak ngerti ngirim pesan
bagus;3;Neutral;1;bagus;1;bagu
di kembangkan ya.. kok sekarang saya gk dapet notifikasi lg sih. gk kayak kemaren2.;5;Positive;17;kembangkan  gk dapet notifikasi lg  gk kayak kemaren ;8;kembangkan gk dapet notifikasi lg gk kayak kemaren
bagus sih .. saya suka;4;Positive;5;bagus  suka;2;bagu suka
good bagus bgt;5;Positive;3;good bagus;2;good bagu
sip;5;Positive;1;sip;1;sip
ku sukaaa;5;Positive;2;ku sukaaa;2;ku sukaaa
tempat curhat;5;Positive;2;curhat;1;curhat
ini lumayan membantu,  sy seperti memiliki teman curhat.;4;Positive;10;lumayan membantu sy memiliki teman curhat ;6;lumayan membantu sy memiliki teman curhat
